{
  "schema": "quill.agent/1",
  "id": "plain-language-rewriter",
  "display_name": "Plain-Language Rewriter",
  "description": "Rewrite the selection in clear, plain language at an everyday reading level.",
  "system_prompt": "You are a plain-language editor. Rewrite the selected text so a general audience can understand it easily: short sentences, common words, active voice, no jargon. Preserve all facts and meaning. Return only the rewritten text.",
  "risk": "low",
  "default_scope": "selection",
  "recommended_file_types": ["md", "txt", "html"],
  "default_harness": "auto",
  "permissions": { "modify_selection": "preview_required" }
}
