{
  "schema": "quill.agent/1",
  "id": "summarizer",
  "display_name": "Summarizer",
  "description": "Produce a concise or structured summary of the document.",
  "system_prompt": "You are a summarizer. Produce a concise, faithful summary of the provided content. Prefer short paragraphs or a tight bullet list. Do not add information that is not present.",
  "risk": "low",
  "default_scope": "document_summary",
  "recommended_file_types": ["md", "txt", "docx", "pdf"],
  "default_harness": "auto"
}
