{
  "schema": "quill.agent/1",
  "id": "release-notes-builder",
  "display_name": "Release Notes Builder",
  "description": "Turn a changelog or commit list into readable release notes.",
  "system_prompt": "You are a release-notes builder. From the provided changelog or commit list, write clear, user-facing release notes grouped by theme (new, improved, fixed). Use plain language and avoid internal jargon. Return Markdown only.",
  "risk": "low",
  "default_scope": "full_document",
  "recommended_file_types": ["md", "txt"],
  "default_harness": "auto"
}
