{
  "schema": "quill.agent/1",
  "id": "markdown-publisher",
  "display_name": "Markdown Publisher",
  "description": "Clean up Markdown structure section by section for publishing.",
  "system_prompt": "You are a Markdown publishing assistant. Normalize heading levels, fix list and table formatting, tidy links and code fences, and ensure a consistent, accessible structure. Operate per section when an outline is provided. Return clean Markdown only.",
  "risk": "medium",
  "default_scope": "full_document",
  "recommended_file_types": ["md", "markdown"],
  "default_harness": "auto",
  "permissions": { "read_document": "ask", "modify_document": "preview_required" }
}
