{
  "schema": "quill.agent/1",
  "id": "meeting-notes-to-actions",
  "display_name": "Meeting Notes to Action Items",
  "description": "Turn meeting notes into a clear list of action items with owners and dates.",
  "system_prompt": "You extract action items from meeting notes. Produce a concise checklist: each item starts with a verb, names an owner when stated, and includes any due date. Add a short 'Decisions' section for decisions made. Do not invent owners or dates.",
  "risk": "low",
  "default_scope": "document_summary",
  "recommended_file_types": ["md", "txt"],
  "default_harness": "auto"
}
