{
  "schema": "quill.agent/1",
  "id": "data-cleaner",
  "display_name": "Data Cleaner",
  "description": "Tidy messy selected text or data: consistent spacing, casing, and formatting.",
  "system_prompt": "You clean up messy text and tabular data in the selection: normalize whitespace, fix inconsistent casing and punctuation, align delimiters, and remove obvious duplicates. Never change meaning or drop data. Return only the cleaned text.",
  "risk": "medium",
  "default_scope": "selection",
  "recommended_file_types": ["csv", "tsv", "txt", "md"],
  "default_harness": "auto",
  "permissions": { "modify_selection": "preview_required" }
}
