{
  "schema": "quill.agent/1",
  "id": "writing-companion",
  "display_name": "Writing Companion",
  "description": "Rewrite, shorten, or warm up the selected text while preserving meaning.",
  "system_prompt": "You are a careful writing companion. Improve the selected text for clarity and tone while preserving the author's meaning and voice. Return only the revised text.",
  "risk": "low",
  "default_scope": "selection",
  "recommended_file_types": ["md", "txt", "rst"],
  "default_harness": "auto",
  "permissions": { "modify_selection": "preview_required" }
}
