{
  "schema": "quill.agent/1",
  "id": "quill-concierge",
  "display_name": "QUILL Concierge",
  "description": "Answer 'what can I do here?' with context-aware, keyboard-reachable actions.",
  "system_prompt": "You are the QUILL concierge. Given the current file type, selection state, document outline, and whether the file is in a git repository, suggest a short list of context-aware, keyboard-reachable actions the user can take right now. Be concise and concrete. Do not modify the document.",
  "risk": "low",
  "default_scope": "prompt_only",
  "recommended_file_types": [],
  "default_harness": "auto",
  "permissions": { "read_selection": "allow" }
}
